{
  "schemaVersion": "1.0.0",
  "generatedAt": "2026-08-08",
  "phase": "S2",
  "scope": "semantic-role registry derived from Unicode-declared contexts plus locked-backend observation",
  "summary": {
    "targetCount": 93,
    "semanticRoleCount": 93,
    "byBackendStatus": {
      "project-glyph-required": 18,
      "supported": 75
    }
  },
  "targets": [
    {
      "id": "s2-role-001-isolate",
      "semanticRole": "MONGOLIAN_A.isolate.form2",
      "character": "MONGOLIAN LETTER A",
      "baseCodePoint": "U+1820",
      "selectorCodePoint": "U+180B",
      "inputSequence": [
        "U+1820",
        "U+180B"
      ],
      "joiningState": "isolate",
      "variationIntent": "form2",
      "desiredAppearance": "second form",
      "source": {
        "url": "https://www.unicode.org/Public/17.0.0/ucd/StandardizedVariants.txt",
        "section": "Mongolian standardized variation sequences",
        "source_line": 226
      },
      "ruleStatus": "unicode-declared-target",
      "backend": {
        "id": "noto-sans-mongolian-3.002-harfbuzz-14.3.0",
        "status": "supported",
        "observation": "aligned",
        "targetGlyphIds": [
          6
        ],
        "defaultGlyphIds": [
          5
        ]
      }
    },
    {
      "id": "s2-role-001-medial",
      "semanticRole": "MONGOLIAN_A.medial.form2",
      "character": "MONGOLIAN LETTER A",
      "baseCodePoint": "U+1820",
      "selectorCodePoint": "U+180B",
      "inputSequence": [
        "U+1820",
        "U+180B"
      ],
      "joiningState": "medial",
      "variationIntent": "form2",
      "desiredAppearance": "second form",
      "source": {
        "url": "https://www.unicode.org/Public/17.0.0/ucd/StandardizedVariants.txt",
        "section": "Mongolian standardized variation sequences",
        "source_line": 226
      },
      "ruleStatus": "unicode-declared-target",
      "backend": {
        "id": "noto-sans-mongolian-3.002-harfbuzz-14.3.0",
        "status": "supported",
        "observation": "aligned",
        "targetGlyphIds": [
          11
        ],
        "defaultGlyphIds": [
          10
        ]
      }
    },
    {
      "id": "s2-role-001-final",
      "semanticRole": "MONGOLIAN_A.final.form2",
      "character": "MONGOLIAN LETTER A",
      "baseCodePoint": "U+1820",
      "selectorCodePoint": "U+180B",
      "inputSequence": [
        "U+1820",
        "U+180B"
      ],
      "joiningState": "final",
      "variationIntent": "form2",
      "desiredAppearance": "second form",
      "source": {
        "url": "https://www.unicode.org/Public/17.0.0/ucd/StandardizedVariants.txt",
        "section": "Mongolian standardized variation sequences",
        "source_line": 226
      },
      "ruleStatus": "unicode-declared-target",
      "backend": {
        "id": "noto-sans-mongolian-3.002-harfbuzz-14.3.0",
        "status": "supported",
        "observation": "aligned",
        "targetGlyphIds": [
          13
        ],
        "defaultGlyphIds": [
          12
        ]
      }
    },
    {
      "id": "s2-role-002-medial",
      "semanticRole": "MONGOLIAN_A.medial.form3",
      "character": "MONGOLIAN LETTER A",
      "baseCodePoint": "U+1820",
      "selectorCodePoint": "U+180C",
      "inputSequence": [
        "U+1820",
        "U+180C"
      ],
      "joiningState": "medial",
      "variationIntent": "form3",
      "desiredAppearance": "third form",
      "source": {
        "url": "https://www.unicode.org/Public/17.0.0/ucd/StandardizedVariants.txt",
        "section": "Mongolian standardized variation sequences",
        "source_line": 227
      },
      "ruleStatus": "unicode-declared-target",
      "backend": {
        "id": "noto-sans-mongolian-3.002-harfbuzz-14.3.0",
        "status": "project-glyph-required",
        "observation": "missing_variant_response",
        "targetGlyphIds": [
          10
        ],
        "defaultGlyphIds": [
          10
        ]
      }
    },
    {
      "id": "s2-role-003-initial",
      "semanticRole": "MONGOLIAN_E.initial.form2",
      "character": "MONGOLIAN LETTER E",
      "baseCodePoint": "U+1821",
      "selectorCodePoint": "U+180B",
      "inputSequence": [
        "U+1821",
        "U+180B"
      ],
      "joiningState": "initial",
      "variationIntent": "form2",
      "desiredAppearance": "second form",
      "source": {
        "url": "https://www.unicode.org/Public/17.0.0/ucd/StandardizedVariants.txt",
        "section": "Mongolian standardized variation sequences",
        "source_line": 228
      },
      "ruleStatus": "unicode-declared-target",
      "backend": {
        "id": "noto-sans-mongolian-3.002-harfbuzz-14.3.0",
        "status": "supported",
        "observation": "aligned",
        "targetGlyphIds": [
          17
        ],
        "defaultGlyphIds": [
          16
        ]
      }
    },
    {
      "id": "s2-role-003-final",
      "semanticRole": "MONGOLIAN_E.final.form2",
      "character": "MONGOLIAN LETTER E",
      "baseCodePoint": "U+1821",
      "selectorCodePoint": "U+180B",
      "inputSequence": [
        "U+1821",
        "U+180B"
      ],
      "joiningState": "final",
      "variationIntent": "form2",
      "desiredAppearance": "second form",
      "source": {
        "url": "https://www.unicode.org/Public/17.0.0/ucd/StandardizedVariants.txt",
        "section": "Mongolian standardized variation sequences",
        "source_line": 228
      },
      "ruleStatus": "unicode-declared-target",
      "backend": {
        "id": "noto-sans-mongolian-3.002-harfbuzz-14.3.0",
        "status": "supported",
        "observation": "aligned",
        "targetGlyphIds": [
          20
        ],
        "defaultGlyphIds": [
          19
        ]
      }
    },
    {
      "id": "s2-role-004-medial",
      "semanticRole": "MONGOLIAN_I.medial.form2",
      "character": "MONGOLIAN LETTER I",
      "baseCodePoint": "U+1822",
      "selectorCodePoint": "U+180B",
      "inputSequence": [
        "U+1822",
        "U+180B"
      ],
      "joiningState": "medial",
      "variationIntent": "form2",
      "desiredAppearance": "second form",
      "source": {
        "url": "https://www.unicode.org/Public/17.0.0/ucd/StandardizedVariants.txt",
        "section": "Mongolian standardized variation sequences",
        "source_line": 229
      },
      "ruleStatus": "unicode-declared-target",
      "backend": {
        "id": "noto-sans-mongolian-3.002-harfbuzz-14.3.0",
        "status": "supported",
        "observation": "aligned",
        "targetGlyphIds": [
          27
        ],
        "defaultGlyphIds": [
          26
        ]
      }
    },
    {
      "id": "s2-role-005-medial",
      "semanticRole": "MONGOLIAN_O.medial.form2",
      "character": "MONGOLIAN LETTER O",
      "baseCodePoint": "U+1823",
      "selectorCodePoint": "U+180B",
      "inputSequence": [
        "U+1823",
        "U+180B"
      ],
      "joiningState": "medial",
      "variationIntent": "form2",
      "desiredAppearance": "second form",
      "source": {
        "url": "https://www.unicode.org/Public/17.0.0/ucd/StandardizedVariants.txt",
        "section": "Mongolian standardized variation sequences",
        "source_line": 230
      },
      "ruleStatus": "unicode-declared-target",
      "backend": {
        "id": "noto-sans-mongolian-3.002-harfbuzz-14.3.0",
        "status": "supported",
        "observation": "aligned",
        "targetGlyphIds": [
          33
        ],
        "defaultGlyphIds": [
          32
        ]
      }
    },
    {
      "id": "s2-role-005-final",
      "semanticRole": "MONGOLIAN_O.final.form2",
      "character": "MONGOLIAN LETTER O",
      "baseCodePoint": "U+1823",
      "selectorCodePoint": "U+180B",
      "inputSequence": [
        "U+1823",
        "U+180B"
      ],
      "joiningState": "final",
      "variationIntent": "form2",
      "desiredAppearance": "second form",
      "source": {
        "url": "https://www.unicode.org/Public/17.0.0/ucd/StandardizedVariants.txt",
        "section": "Mongolian standardized variation sequences",
        "source_line": 230
      },
      "ruleStatus": "unicode-declared-target",
      "backend": {
        "id": "noto-sans-mongolian-3.002-harfbuzz-14.3.0",
        "status": "supported",
        "observation": "aligned",
        "targetGlyphIds": [
          35
        ],
        "defaultGlyphIds": [
          34
        ]
      }
    },
    {
      "id": "s2-role-006-medial",
      "semanticRole": "MONGOLIAN_U.medial.form2",
      "character": "MONGOLIAN LETTER U",
      "baseCodePoint": "U+1824",
      "selectorCodePoint": "U+180B",
      "inputSequence": [
        "U+1824",
        "U+180B"
      ],
      "joiningState": "medial",
      "variationIntent": "form2",
      "desiredAppearance": "second form",
      "source": {
        "url": "https://www.unicode.org/Public/17.0.0/ucd/StandardizedVariants.txt",
        "section": "Mongolian standardized variation sequences",
        "source_line": 231
      },
      "ruleStatus": "unicode-declared-target",
      "backend": {
        "id": "noto-sans-mongolian-3.002-harfbuzz-14.3.0",
        "status": "supported",
        "observation": "aligned",
        "targetGlyphIds": [
          42
        ],
        "defaultGlyphIds": [
          41
        ]
      }
    },
    {
      "id": "s2-role-007-medial",
      "semanticRole": "MONGOLIAN_OE.medial.form2",
      "character": "MONGOLIAN LETTER OE",
      "baseCodePoint": "U+1825",
      "selectorCodePoint": "U+180B",
      "inputSequence": [
        "U+1825",
        "U+180B"
      ],
      "joiningState": "medial",
      "variationIntent": "form2",
      "desiredAppearance": "second form",
      "source": {
        "url": "https://www.unicode.org/Public/17.0.0/ucd/StandardizedVariants.txt",
        "section": "Mongolian standardized variation sequences",
        "source_line": 232
      },
      "ruleStatus": "unicode-declared-target",
      "backend": {